310M200US46660,46660,"Valdosta, GA Metro Area",0.4961,0.0359
310M200US46700,46700,"Vallejo-Fairfield, CA Metro Area",0.4184,0.0166
310M200US47020,47020,"Victoria, TX Metro Area",0.4641,0.0295
310M200US47220,47220,"Vineland-Bridgeton, NJ Metro Area",0.4461,0.0244
310M200US47260,47260,"Virginia Beach-Norfolk-Newport News, VA-NC Metro Area",0.4305,0.0065
310M200US47300,47300,"Visalia-Porterville, CA Metro Area",0.4599,0.0165
310M200US47380,47380,"Waco, TX Metro Area",0.4628,0.0183
310M200US47460,47460,"Walla Walla, WA Metro Area",0.4396,0.0369
310M200US47580,47580,"Warner Robins, GA Metro Area",0.4425,0.0238
310M200US47900,47900,"Washington-Arlington-Alexandria, DC-VA-MD-WV Metro Area",0.4411,0.0033
310M200US47940,47940,"Waterloo-Cedar Falls, IA Metro Area",0.4232,0.0166
310M200US48060,48060,"Watertown-Fort Drum, NY Metro Area",0.4137,0.0258
310M200US48140,48140,"Wausau, WI Metro Area",0.4152,0.0158
310M200US48260,48260,"Weirton-Steubenville, WV-OH Metro Area",0.4339,0.0262
310M200US48300,48300,"Wenatchee, WA Metro Area",0.4421,0.0313
310M200US48540,48540,"Wheeling, WV-OH Metro Area",0.4493,0.0143
310M200US48620,48620,"Wichita, KS Metro Area",0.4566,0.0108
310M200US48660,48660,"Wichita Falls, TX Metro Area",0.4626,0.0303
310M200US48700,48700,"Williamsport, PA Metro Area",0.4324,0.0178
310M200US48900,48900,"Wilmington, NC Metro Area",0.4866,0.0180
310M200US49020,49020,"Winchester, VA-WV Metro Area",0.4448,0.0246
310M200US49180,49180,"Winston-Salem, NC Metro Area",0.4534,0.0105
310M200US49340,49340,"Worcester, MA-CT Metro Area",0.4502,0.0099
310M200US49420,49420,"Yakima, WA Metro Area",0.4388,0.0271
310M200US49620,49620,"York-Hanover, PA Metro Area",0.4298,0.0133
310M200US49660,49660,"Youngstown-Warren-Boardman, OH-PA Metro Area",0.4450,0.0120
310M200US49700,49700,"Yuba City, CA Metro Area",0.4436,0.0255
310M200US49740,49740,"Yuma, AZ Metro Area",0.4592,0.0243
